<!ELEMENT task (A,A_B,B,C)>
<!ELEMENT A (Ab,Ac)>
<!ATTLIST A Aa NMTOKEN #REQUIRED>
<!ELEMENT Ab (Abx,Aby)>
<!ELEMENT Abx EMPTY>
<!ELEMENT Aby EMPTY>
<!ELEMENT Ac (Acd,Ace)>
<!ELEMENT Acd EMPTY>
<!ELEMENT Ace EMPTY>
<!ELEMENT A_B (A_Bc)>
<!ELEMENT A_Bc EMPTY>
<!ELEMENT B (Bb)>
<!ATTLIST B Ba NMTOKEN #REQUIRED>
<!ELEMENT Bb (Bbx,Bby)>
<!ELEMENT Bbx EMPTY>
<!ELEMENT Bby EMPTY>
<!ELEMENT C (Cb)>
<!ATTLIST C Ca NMTOKEN #REQUIRED>
<!ELEMENT Cb EMPTY>